{
  "fixture_contract_version": "1.0",
  "fixture_id": "windows-security-4624-network-logon-success-001",
  "source_format": "windows_security_eventlog_json",
  "provider_name": "Microsoft-Windows-Security-Auditing",
  "provider_guid": "{54849625-5478-4994-a5ba-3e3b0328c30d}",
  "provider_event_id": 4624,
  "event_version": 2,
  "event_level": 0,
  "event_task": 12544,
  "event_opcode": 0,
  "event_keywords": "0x8020000000000000",
  "event_record_id": 42001,
  "computer": "WIN-FIXTURE01",
  "channel": "Security",
  "system_time": "2026-01-15T02:00:00.123000Z",
  "subject_user_sid": "S-1-5-18",
  "subject_user_name": "WIN-FIXTURE01$",
  "subject_domain_name": "LAB",
  "subject_logon_id": "0x3E7",
  "target_user_sid": "S-1-5-21-111111111-222222222-333333333-1001",
  "target_user_name": "fixture-user",
  "target_domain_name": "LAB",
  "target_logon_id": "0xABC001",
  "logon_type": 3,
  "logon_process_name": "NtLmSsp",
  "authentication_package_name": "NTLM",
  "workstation_name": "WIN-CLIENT01",
  "source_ip": "198.51.100.24",
  "source_port": 54432
}
